{
  "id": "en1fr1",
  "title": [
    {
      "lang": "de",
      "value": "Metadatenprofile für Testaufgaben: Fremdsprachen Sek I"
    }
  ],
  "mdOutDir": "docs",
  "creator": "IQB - Institut zur Qualitätsentwicklung im Bildungswesen",
  "profiles": [
    "json_schema/md-profile/test_valid/sample_1.json"
  ]
}
